{
  "schema_version": "1.0.0",
  "registry_id": "blorenge-launch",
  "reviewed_at": "2026-08-21T21:00:00Z",
  "release_authority": "timjroberts",
  "status": "approved",
  "status_reason": "The chair-reviewed BCA-area of interest, exact 2 km release AOI rule, retained SSSI context, bounded incident chronology, EFFIS event match, selected observations, licence snapshots and fail-closed AOI-level scene QA are approved for controlled manual releases.",
  "area_of_interest": {
    "status": "validated_release_rule",
    "core_dataset_id": "bca-area-of-interest",
    "core_label": "BCA-area of interest",
    "core_version": "2026-08-21.1",
    "core_path": "Blorenge.geojson",
    "core_sha256": "825404bb2e7fb85620d874b900a0884e3dc5f0107c26b5491dca665f90f77d73",
    "source_capture_path": "Blorenge_small.geojson",
    "source_capture_sha256": "ddbf971f4a134e23b8d5a97611a48617d91a3f6a56eae7e2b28bdc182ca932ee",
    "buffer_distance_m": 2000,
    "buffer_crs": "EPSG:27700",
    "clip_mode": "exact",
    "rule": "Preserve the canonical core separately; derive the release-wide AOI by transforming it to EPSG:27700 and buffering by exactly 2000 metres. Rebuild every AOI-dependent input and output for a new core version.",
    "limitations": "The core is a BCA-defined approximate landscape area, not the legal, official, surveyed or current boundary of Blorenge Common CL18. The Blorenge SSSI remains a separate authoritative context layer."
  },
  "sources": [
    {
      "dataset_id": "bca-area-of-interest",
      "title": "BCA-area of interest",
      "purpose": "Canonical chair-reviewed core geometry used to derive the release-wide exact 2 km processing and display AOI.",
      "classification": "bca_defined_approximate",
      "provider": "Blorenge Commoners Association",
      "provider_dataset_id": "bca-area-of-interest/2026-08-21.1",
      "landing_url": "https://github.com/timjroberts/bca_wales/blob/main/Blorenge.geojson",
      "acquisition": {
        "method": "Checksum-pinned repository source copy",
        "path": "Blorenge.geojson",
        "media_type": "application/geo+json",
        "crs": "EPSG:4326",
        "expected_features": 1,
        "version": "2026-08-21.1",
        "sha256": "825404bb2e7fb85620d874b900a0884e3dc5f0107c26b5491dca665f90f77d73"
      },
      "upstream": {
        "captured_date": "2026-08-21",
        "review": "Captured by the owner and reviewed with the BCA chair.",
        "refresh_policy": "Manual only. Any geometry or provenance change requires a new version, checksum and full AOI-dependent rebuild."
      },
      "licence": {
        "id": "BCA-publication-authority",
        "url": "https://github.com/timjroberts/bca_wales/blob/main/data/launch/licences/bca-area-of-interest.md",
        "attribution": "Blorenge Commoners Association",
        "reviewed_at": "2026-08-21"
      },
      "schema": {
        "geometry": "Polygon",
        "required_fields": ["name", "classification", "owner", "version", "captured_date", "capture_method", "source_crs", "source_sha256", "limitations"]
      },
      "transformation": "Preserve the canonical polygon unchanged; derive the release AOI only by transforming to EPSG:27700 and applying an exact 2000 metre buffer.",
      "known_gaps": ["This is an approximate BCA working area and must never be presented as the legal or official CL18 boundary."],
      "safety": "public_safe_with_non_legal_boundary_label",
      "publication": "approved_candidate",
      "contract": {
        "owner": "timjroberts",
        "temporal_role": "versioned release core",
        "licence_terms": { "snapshot_path": "licences/bca-area-of-interest.md", "sha256": "9afa5d7000b3c391d70fc793823b6066bb7ddfe8ec4ec17cc4d01b3c38f58a8d" },
        "recipe": { "id": "bca-area-of-interest", "version": "2.0.0" },
        "output_profiles": ["geojson", "accessible_json"],
        "refresh": { "mode": "manual", "maximum_age_days": null, "approved_change_bounds": {} },
        "retention": "Retain every canonical version and raw reviewed capture used by a published release.",
        "withdrawal": "Withdraw affected releases without substituting another geometry or weakening the boundary limitation."
      }
    },
    {
      "dataset_id": "nrw-sssi",
      "title": "Sites of Special Scientific Interest (SSSI)",
      "purpose": "Authoritative protected-site context and the validated launch-core component.",
      "classification": "authoritative",
      "provider": "Natural Resources Wales",
      "provider_dataset_id": "inspire-nrw:NRW_SSSI",
      "landing_url": "https://datamap.gov.wales/layers/inspire-nrw%3ANRW_SSSI/metadata_detail",
      "acquisition": {
        "method": "WFS 2.0 GetFeature",
        "url": "https://datamap.gov.wales/geoserver/ows?service=WFS&version=2.0.0&request=GetFeature&typeNames=inspire-nrw%3ANRW_SSSI&outputFormat=application%2Fjson&srsName=EPSG%3A27700&CQL_FILTER=sssi_name%20ILIKE%20%27%25Blorenge%25%27",
        "media_type": "application/geo+json",
        "crs": "EPSG:27700",
        "stable_selector": "sssi_code = 33WFL",
        "expected_features": 1
      },
      "upstream": {
        "publication_date": "2026-07-30",
        "feature_last_edited": "2008-11-28",
        "cadence": "not stated",
        "refresh_policy": "Poll monthly; manual review on identifier, geometry, schema, attribution or metadata change."
      },
      "licence": {
        "id": "OGL-3.0",
        "url": "https://www.nationalarchives.gov.uk/doc/open-government-licence/version/3/",
        "attribution": "Contains Natural Resources Wales information © Natural Resources Wales and Database Right. All rights Reserved. Contains Ordnance Survey Data. Ordnance Survey Licence number AC0000849444. Crown Copyright and Database Right.",
        "reviewed_at": "2026-08-09"
      },
      "schema": {
        "geometry": "MultiPolygon",
        "required_fields": ["sssi_name", "sssi_id", "sssi_code", "first_notified", "last_notified", "last_edited", "cartesian_area_ha", "spherical_area_ha", "status", "id"]
      },
      "transformation": "Select 33WFL, preserve source identifiers and dates, repair no geometry, reproject only in derived outputs, and publish source geometry separately from the derived AOI union.",
      "known_gaps": ["A designation boundary does not describe current condition or permitted operations."],
      "safety": "public_safe",
      "publication": "approved_candidate",
      "contract": {
        "owner": "timjroberts",
        "temporal_role": "current designation context",
        "licence_terms": { "snapshot_path": "licences/ogl-3.0.md", "sha256": "5a19f85959896038ec055fc6acc6333a7a6339f9271c388c61bd1653e51185ec" },
        "recipe": { "id": "nrw-sssi", "version": "1.0.0" },
        "output_profiles": ["geojson", "accessible_json"],
        "refresh": { "mode": "manual", "maximum_age_days": 31, "approved_change_bounds": {} },
        "retention": "Retain every exact input used by a published release until disposal is explicitly approved.",
        "withdrawal": "Withdraw the public release pointer without deleting the immutable audit archive."
      }
    },
    {
      "dataset_id": "nrw-national-park",
      "title": "National Parks",
      "purpose": "Authoritative Bannau Brycheiniog National Park context.",
      "classification": "authoritative",
      "provider": "Natural Resources Wales",
      "provider_dataset_id": "inspire-nrw:NRW_NATIONAL_PARK",
      "landing_url": "https://datamap.gov.wales/layers/inspire-nrw%3ANRW_NATIONAL_PARK/metadata_detail",
      "acquisition": {
        "method": "WFS 2.0 GetFeature followed by AOI clip",
        "url": "https://datamap.gov.wales/geoserver/ows?service=WFS&version=2.0.0&request=GetFeature&typeNames=inspire-nrw%3ANRW_NATIONAL_PARK&outputFormat=application%2Fjson&srsName=EPSG%3A27700",
        "media_type": "application/geo+json",
        "crs": "EPSG:27700",
        "stable_selector": "isis_id = 2449",
        "feature_id": "NRW_NATIONAL_PARK.2"
      },
      "upstream": {
        "publication_date": "2025-05-29",
        "feature_edit_date": "2015-03-01",
        "cadence": "not stated",
        "refresh_policy": "Poll quarterly and review any geometry, name, schema or attribution change."
      },
      "licence": {
        "id": "OGL-3.0",
        "url": "https://www.nationalarchives.gov.uk/doc/open-government-licence/version/3/",
        "attribution": "Contains Natural Resources Wales information © Natural Resources Wales and Database Right. All rights Reserved. Contains Ordnance Survey Data. Ordnance Survey Licence number AC0000849444. Crown Copyright and Database Right.",
        "reviewed_at": "2026-08-09"
      },
      "schema": {
        "geometry": "MultiPolygon",
        "required_fields": ["objectid", "np_name", "desig_date", "edit_date", "area_ha", "isis_id"]
      },
      "transformation": "Select isis_id 2449, clip for display without changing the source identity, and retain the full source boundary in private reproducibility storage.",
      "known_gaps": ["The boundary supplies designation context, not site condition."],
      "safety": "public_safe",
      "publication": "approved_candidate",
      "contract": {
        "owner": "timjroberts",
        "temporal_role": "current designation context",
        "licence_terms": { "snapshot_path": "licences/ogl-3.0.md", "sha256": "5a19f85959896038ec055fc6acc6333a7a6339f9271c388c61bd1653e51185ec" },
        "recipe": { "id": "nrw-national-park", "version": "1.0.0" },
        "output_profiles": ["geojson", "accessible_json"],
        "refresh": { "mode": "manual", "maximum_age_days": 93, "approved_change_bounds": {} },
        "retention": "Retain every exact input used by a published release until disposal is explicitly approved.",
        "withdrawal": "Withdraw the public release pointer without deleting the immutable audit archive."
      }
    },
    {
      "dataset_id": "nrw-open-registered-common",